{
  "$schema": "http://json-schema.org/draft-07/schema#",
  "title": "Verovo Outcome Unit (v1, rev 0.2: + action / usage_aggregate)",
  "description": "BP r28 p14 'Emerging · Outcome' row: the billable unit for outcome-priced contracts beyond per-resolution support — a qualified lead, a completed case. This schema defines the unit BEFORE any engine reads it: one file, one unit, every field traceable to a contract clause or an observer. Judgement discipline mirrors VSS-1: a criterion that cannot be evidenced is listed in criteria_unproven, never silently counted; status 'unproven' is a first-class state. vendor and buyer each keep their own units; agreement is a separate reconciliation, never assumed.",
  "type": "object",
  "required": [
    "schema_version",
    "unit_id",
    "unit_type",
    "contract_ref",
    "occurred_at",
    "declared_by",
    "observer_grade",
    "qualification",
    "status"
  ],
  "properties": {
    "schema_version": {
      "type": "string",
      "enum": ["verovo-outcome-0.1"]
    },
    "unit_id": {
      "type": "string",
      "pattern": "^[A-Za-z0-9][A-Za-z0-9._:/-]*$",
      "description": "Stable id of this billable outcome in the declaring party's system."
    },
    "unit_type": {
      "type": "string",
      "enum": ["qualified_lead", "completed_case", "action", "usage_aggregate"],
      "description": "qualified_lead: sales outcome pricing. completed_case: BPO / services outcome pricing. action: per-action billing (Copilot premium request, Cursor credit, Devin ACU) — v0.2, one unit = one consumed action, allowance via billing_context. usage_aggregate: metered usage (A3, e.g. compute units) — v0.2, quantity via measured_quantity. Per-resolution support stays on the canonical seven-column export (registry/vendor-rules.json). One evidence plane, four unit types."
    },
    "contract_ref": {
      "type": "string",
      "minLength": 1,
      "description": "The contract clause that defines qualification / completion, cited by section. A unit without a clause is not a unit."
    },
    "occurred_at": {
      "type": "string",
      "format": "date-time",
      "description": "When the outcome happened (lead qualified, case completed). ISO 8601."
    },
    "declared_by": {
      "type": "string",
      "enum": ["vendor", "buyer"],
      "description": "Which side counts this unit. Both sides' ledgers reconcile; neither is authoritative by itself."
    },
    "observer_grade": {
      "type": "string",
      "enum": ["self_attested", "affected_party", "third_party_corroborated"],
      "description": "Same evidence ladder as VSS-1 settlement (standard/SETTLEMENT.md): who observed the outcome."
    },
    "qualification": {
      "type": "object",
      "required": ["criteria_met"],
      "properties": {
        "criteria_met": {
          "type": "array",
          "items": {"type": "string", "minLength": 1},
          "description": "Each contract criterion this unit satisfies, in the contract's own words."
        },
        "criteria_unproven": {
          "type": "array",
          "items": {"type": "string"},
          "description": "Criteria that cannot be evidenced from the supplied records. Listed, never guessed away."
        }
      }
    },
    "status": {
      "type": "string",
      "enum": ["counted", "disputed", "retracted", "unproven"],
      "description": "counted: both the criteria and the evidence stand. disputed: a party contests it. retracted: declarer withdrew. unproven: criteria_unproven is non-empty, so it must not enter any claim total."
    },
    "window": {
      "type": "object",
      "properties": {
        "stability_hours": {
          "type": "number",
          "exclusiveMinimum": 0,
          "description": "Contractual observation window after which the outcome is stable (e.g. lead not withdrawn within N hours)."
        },
        "reopened_at": {
          "type": "array",
          "items": {"type": "string", "format": "date-time"},
          "description": "Timestamps of any reopen/withdrawal events inside the window."
        }
      }
    },
    "value": {
      "type": "object",
      "properties": {
        "currency": {"type": "string", "minLength": 3, "maxLength": 3},
        "amount": {"type": "number", "minimum": 0}
      },
      "description": "Contracted value of one unit, when priced."
    },
    "billing_context": {
      "type": "object",
      "properties": {
        "plan_allowance_included": {"type": "number", "minimum": 0},
        "consumed_in_period": {"type": "number", "minimum": 0},
        "overage_billed": {"type": "boolean"}
      },
      "description": "For action units: where this consumption sits relative to the plan allowance. An action inside the allowance and an overage action are different money; they are never merged."
    },
    "measured_quantity": {
      "type": "object",
      "required": ["metric", "quantity"],
      "properties": {
        "metric": {"type": "string", "minLength": 1},
        "quantity": {"type": "number", "minimum": 0},
        "unit": {"type": "string"}
      },
      "description": "For usage_aggregate units: the measured quantity as recorded, with its unit. The metering is the vendor's telemetry, taken as input — Verovo verifies billing, not telemetry."
    },
    "evidence": {
      "type": "array",
      "items": {
        "type": "object",
        "required": ["kind", "ref"],
        "properties": {
          "kind": {
            "type": "string",
            "enum": ["system_record", "export", "attestation", "corroboration"]
          },
          "ref": {"type": "string", "minLength": 1}
        }
      }
    }
  }
}
